post_id,title,link,content
25648339,8月2日路畅科技涨停分析：自动刹车，激光雷达，胎压监测概念热股,https://news.moomoo.com/post/25648339,路畅科技涨停收盘，收盘价38.02元。该股于13点23分涨停，2次打开涨停，截止收盘封单资金为2645.81万元，占其流通市值0.59%。8月2日的资金流向数据方面，主力资金净流入7251.74万元，占总成交额19.38%，游资资金净流出2989.55万元，占总成交额7.99%，散户资金净流出4262.19万元，占总成交额11.39%。近5日资金流向一览见下表：该股为自动刹车，激光雷达，胎压监测概念热股，当日自动刹车概念上涨1.77%，激光雷达概念上涨1.19%，胎压监测概念上涨1.09%。以上内容由证券之星根据公开信息整理，由算法生成，与本站立场无关。证券之星力求但不保证该信息（包括但不限于文字、视频、音频、数据及图表）全部或者部分内容的的准确性、完整性、有效性、及时性等，如存在问题请联系我们。本文为数据整理，不对您构成任何投资建议，投资有风险，请谨慎决策。
25648341,8月2日大智慧涨停分析：金融科技，国产软件概念热股,https://news.moomoo.com/post/25648341,大智慧涨停收盘，收盘价9.01元。该股于13点38分涨停，未打开涨停，截止收盘封单资金为1.16亿元，占其流通市值0.64%。8月2日的资金流向数据方面，主力资金净流入2.44亿元，占总成交额14.69%，游资资金净流出1.05亿元，占总成交额6.33%，散户资金净流出1.39亿元，占总成交额8.37%。近5日资金流向一览见下表：该股为金融科技，国产软件概念热股，当日金融科技概念上涨1.1%，国产软件概念上涨0.61%。以上内容由证券之星根据公开信息整理，由算法生成，与本站立场无关。证券之星力求但不保证该信息（包括但不限于文字、视频、音频、数据及图表）全部或者部分内容的的准确性、完整性、有效性、及时性等，如存在问题请联系我们。本文为数据整理，不对您构成任何投资建议，投资有风险，请谨慎决策。
25648342,8月2日浙江世宝涨停分析：线控底盘，汽车零部件，新能源车零部件概念热股,https://news.moomoo.com/post/25648342,浙江世宝涨停收盘，收盘价17.38元。该股于14点6分涨停，未打开涨停，截止收盘封单资金为1.06亿元，占其流通市值1.1%。8月2日的资金流向数据方面，主力资金净流入3.15亿元，占总成交额15.33%，游资资金净流出1.47亿元，占总成交额7.17%，散户资金净流出1.68亿元，占总成交额8.16%。近5日资金流向一览见下表：该股为线控底盘，汽车零部件，新能源车零部件概念热股，当日线控底盘概念上涨1.43%，汽车零部件概念上涨0.62%，新能源车零部件概念上涨0.59%。以上内容由证券之星根据公开信息整理，由算法生成，与本站立场无关。证券之星力求但不保证该信息（包括但不限于文字、视频、音频、数据及图表）全部或者部分内容的的准确性、完整性、有效性、及时性等，如存在问题请联系我们。本文为数据整理，不对您构成任何投资建议，投资有风险，请谨慎决策。
25648347,8月2日中马传动涨停分析：汽车零部件，新能源车零部件，新能源汽车概念热股,https://news.moomoo.com/post/25648347,中马传动涨停收盘，收盘价13.11元。该股于14点10分涨停，2次打开涨停，截止收盘封单资金为2256.73万元，占其流通市值0.56%。8月2日的资金流向数据方面，主力资金净流入3125.6万元，占总成交额6.19%，游资资金净流入65.77万元，占总成交额0.13%，散户资金净流出3191.36万元，占总成交额6.32%。近5日资金流向一览见下表：该股为汽车零部件，新能源车零部件，新能源汽车概念热股，当日汽车零部件概念上涨0.62%，新能源车零部件概念上涨0.59%，新能源汽车概念上涨0.23%。以上内容由证券之星根据公开信息整理，由算法生成，与本站立场无关。证券之星力求但不保证该信息（包括但不限于文字、视频、音频、数据及图表）全部或者部分内容的的准确性、完整性、有效性、及时性等，如存在问题请联系我们。本文为数据整理，不对您构成任何投资建议，投资有风险，请谨慎决策。
25648354,8月2日维科精密涨停分析：汽车零部件，新能源车零部件，新能源汽车概念热股,https://news.moomoo.com/post/25648354,维科精密涨停收盘，收盘价50.93元。该股于14点33分涨停，未打开涨停，截止收盘封单资金为6803.61万元，占其流通市值4.08%。8月2日的资金流向数据方面，主力资金净流入5014.64万元，占总成交额4.83%，游资资金净流出4835.98万元，占总成交额4.65%，散户资金净流出178.66万元，占总成交额0.17%。近5日资金流向一览见下表：该股为汽车零部件，新能源车零部件，新能源汽车概念热股，当日汽车零部件概念上涨0.62%，新能源车零部件概念上涨0.59%，新能源汽车概念上涨0.23%。以上内容由证券之星根据公开信息整理，由算法生成，与本站立场无关。证券之星力求但不保证该信息（包括但不限于文字、视频、音频、数据及图表）全部或者部分内容的的准确性、完整性、有效性、及时性等，如存在问题请联系我们。本文为数据整理，不对您构成任何投资建议，投资有风险，请谨慎决策。
25648356,8月2日道森股份涨停分析：PET复合铜箔，铜箔/覆铜板，油服概念热股,https://news.moomoo.com/post/25648356,道森股份涨停收盘，收盘价33.28元。该股于14点52分涨停，未打开涨停，截止收盘封单资金为630.66万元，占其流通市值0.09%。8月2日的资金流向数据方面，主力资金净流入2317.93万元，占总成交额9.61%，游资资金净流出1318.15万元，占总成交额5.46%，散户资金净流出999.78万元，占总成交额4.14%。近5日资金流向一览见下表：该股为PET复合铜箔，铜箔/覆铜板，油服概念热股，当日PET复合铜箔概念上涨3.75%，铜箔/覆铜板概念上涨1.75%。以上内容由证券之星根据公开信息整理，由算法生成，与本站立场无关。证券之星力求但不保证该信息（包括但不限于文字、视频、音频、数据及图表）全部或者部分内容的的准确性、完整性、有效性、及时性等，如存在问题请联系我们。本文为数据整理，不对您构成任何投资建议，投资有风险，请谨慎决策。
25647532,泰国SET指数跌幅收窄。,https://news.moomoo.com/post/25647532,泰国SET指数跌幅收窄。
25647722,"Changyang Technology (688299.SH): The company takes a form of R&D mainly based on independent research and development, with cooperative research and development as a supplement",https://news.moomoo.com/post/25647722,格隆汇8月2日丨长阳科技(688299.SH)近期在接待机构投资者调研时表示，公司采取以自主研发为主，合作研发为辅的研发形式，公司尖端材料研究院负责产品的研发和设计、行业情报的收集以及专利成果的申报。在自主研发方面，公司从研发项目立项、研发费用投入及研发成果评定等方面制定了一系列完善的研发管理制度，设立基膜制备、合成技术、精密涂布/复合、精密加工、光学设计等技术开发中心；在研发流程上面，建立产品开发IPD流程，从产品概念、计划、开发、验证、发布、生命周期管理6个阶段，建立了一个涵盖流程概览、阶段流程、子流程和模板的分层结构框架，搭建了全面的项目管理体系。
25647533,瑞士7月SVME采购经理人指数 38.5，预期44，前值44.9。,https://news.moomoo.com/post/25647533,瑞士7月SVME采购经理人指数 38.5，预期44，前值44.9。
25647707,*瑞銀：澳門7月賭收勝預期 行業首選金沙(01928.HK)和澳博(00880.HK),https://news.moomoo.com/post/25647707,*瑞銀：澳門7月賭收勝預期 行業首選金沙(01928.HK)和澳博(00880.HK)
25647519,研报掘金丨东吴证券：比亚迪销量持续高增，维持“买入”评级,https://news.moomoo.com/post/25647519,格隆汇8月2日丨东吴证券1日研报指出，7月比亚迪(002594.SZ)新能源汽车销量环增4%，出口表现亮眼。其中，纯电份额环比微增，腾势销量持续增长，托举品牌高端化发展。 比亚迪正式进入日本、墨西哥乘用车市场，同时纯电动大巴已正式进入印尼、毛里求斯等国，海外市场放量助力销量增长，预计2023年比亚迪新能源车销量超300万辆，同增60%+，其中出口约20万辆。24-25年为产品大年，预计销量分别为400/500万辆，同增33%/25%。 另外，公司电池装机量同比高增，23年出货预计翻番以上增长，其中储能电池出货30-40gwh，同增150%+，贡献明显增量。 考虑公司销量持续高增，维持公司2023-2025年归母净利润预测为296/420/525亿元，同增78%/42%/25%，对应PE26x/19x/15x，给予2023年35倍PE，目标价355.6元，维持“买入”评级。
25647503,Changyang Technology (688299.SH): The Hefei optical substrate and lithium-ion battery separator project is an important driving force for the company's future business,https://news.moomoo.com/post/25647503,格隆汇8月2日丨长阳科技(688299.SH)近期在接待机构投资者调研时表示，合肥光学基膜及锂离子电池隔膜项目是公司未来业务的重要发力点，公司结合市场情况，制定了详细的商业计划，拟有计划、分步骤投入该项目。上述项目已开工建设，项目建设符合预期，其中锂离子电池隔膜项目干法产品已实现小批量生产及出货，湿法产线已安装和试生产。后续，公司将积极稳妥推进相关产能建设。
25647468,韩国稀有金属储备告急 韩国锂仅够用5.8天,https://news.moomoo.com/post/25647468,数据显示，韩国目前的稀有金属储备量严重不足，使得制造企业对于原材料短缺的担忧持续升级。在韩国唯一的一个稀有金属国家级储备基地，截至今年5月底，基地13种稀有金属的平均储备量只有42天，远低于目标值。其中锂储备量仅有短短的5.8天。究其原因，今年韩国紧缩财政预算，购买稀有金属的拨款相比去年减少了两成多。然而，稀有金属的价格却在剧烈波动，近期锂的市场行情再次走高。分析认为，在电动汽车、太阳能发电等环保大趋势下，如果韩国不能找到合适的对策，稀有金属短缺可能会成为影响韩国相关产业发展的重大风险因素。 （央视财经）
25647595,[BT Agency Stock Review] Adobe Stock Rating Upgraded,https://news.moomoo.com/post/25647595,摩根士丹利将Adobe的股票评级从“持股观望”上调至“增持”，并将其目标价从510美元上调至660美元。该行表示，通过更清晰地了解该公司的人工智能产品和货币化路线图，这增强了该行对该公司重新加速有机增长的信心。
25647449,今年共有10家总部位于深圳的企业入榜世界500强,https://news.moomoo.com/post/25647449,2023年8月2日，最新的《财富》世界500强排行榜正式发布。梳理榜单发现，今年共有10家总部位于深圳的企业入榜，数量与去年持平。其中，中国平安以1815.6亿美元的营业收入，位列第33位；华为以954亿美元的营业收入，位列第111位；正威国际以904亿美元的营业收入，位列第124位；腾讯以824亿美元的营业收入，位列第147位；万科以749亿美元的营业收入，位列第173位；招商银行以723亿美元的营业收入，位列第179位；比亚迪以630亿美元的营业收入，位列第212位；中国电子以403亿美元的营业收入，位列第368位；顺丰以397亿美元的营业收入，位列第377名；深投控以378亿美元的营业收入，位列第391位。（深圳发布）
25647425,市场消息：泰国为泰党提名SRETTHA为泰国总理候选人。为泰党表示将寻求在没有远进党的情况下组建政府。,https://news.moomoo.com/post/25647425,市场消息：泰国为泰党提名SRETTHA为泰国总理候选人。为泰党表示将寻求在没有远进党的情况下组建政府。
25647853,Cinda Securities: The era of humanoid robots is coming and is expected to drive domestic manufacturers into the high-end motor market,https://news.moomoo.com/post/25647853,智通财经APP获悉，信达证券发布研究报告称，人形机器人有望提高机器人相关电机市场空间，驱动国产电机突破中高端电机市场。推荐汇川技术(300124.SZ)、旭升集团(603305.SH);建议关注空心杯电机和步进电机头部企业鸣志电器(603728.SH)、兆威机电(003021.SZ)，工控领先企业伟创电气(688698.SH)、无框电机制造商步科股份(688160.SH)。▍信达证券主要观点如下：控制电机是机器人“动力核心”。电机是一种将电能转换为机械能的装置，主要由外壳、定子、转子、绕组组成。电机种类众多，根据不同方式可以划分为不同种类，应用领域众多，本文主要关注应用在机器人领域的控制电机(伺服电机)。控制电机的产业链上游主要是磁性原材料、编码器、芯片和轴承等，其中磁性材料和编码器相对关键：1)磁性材料对电机性能影响较大，磁性材料中钕铁硼性能较好，渗透率有望提升;2)编码器的分辨率和精度与电机运动控制性能有着密切的关联，可分为磁编码器和光电编码器等，光编码器精度较高，成本较高，磁编码器对环境要求较低。编码器是电机核心部分，国内企业持续突破，有望加速高端电机国产化。人形机器人时代将至，有望带动无框电机&空心杯电机快速增长。机器人相关的电机可以分为伺服电机、直流电机、交流电机和步进电机，机器人需要根据不同场景去选择对应使用电机，工业机器人、服务机器人、协作机器人等机器人根据应用场景不同，会选择不同电机：1)工业机器人对性能和精度要求较高，主要使用伺服电机;2)协作机器人追求轻量化、小型化等特性，通常采用整体式的无框电机，并采用关节一体化技术;3)人形机器人关节要求与协作机器人有相似之处，主要使用无框电机、空心杯电机。从市场角度来看，2021年机器人电机市场规模约11亿美元，随着人形机器人逐步落地，有望贡献新增量，若人形机器人数量超过100万个，将带来电机市场增量344亿元。看好人形机器人带动国内厂商切入高端电机市场。复盘MAXON发展之路，其布局高壁垒产品+新兴领域应用，并布局上游零部件和驱控技术，是MAXON维持高利润的关键。而国内电机企业处于“量增”走向“提质”阶段，部分企业不断加速中高端电机相关行业渗透(工控等)，若人形机器人加速落地，或将给国内企业带来参与先进领域设计/制造的机会：人形机器人潜在空间较大，这类高成长赛道或将带动国内企业对高端电机领域研发和布局，带动国内企业切入高端电机市场。风险因素：核心技术发展不及预期;特斯拉Optimus机器人量产不及预期;地缘政治风险&宏观经济下行风险等。
25647397,格隆汇8月2日丨大和：将福特汽车目标价从12美元上调至13美元。,https://news.moomoo.com/post/25647397,格隆汇8月2日丨大和：将福特汽车目标价从12美元上调至13美元。
25647502,Changyang Technology (688299.SH): has made corresponding reserves for diaphragm-related technology and has corresponding patented technology,https://news.moomoo.com/post/25647502,格隆汇8月2日丨长阳科技(688299.SH)近期在接待机构投资者调研时表示，公司是一家拥有原创技术、核心专利、核心产品研发制造能力的全球领先高分子功能膜高新技术企业，在配方设计、产品制造、设备技术及精密涂布等方面积累了丰富的经验，具有较强的技术研发能力。公司已引进了从事电池隔膜技术研发、产业化经验10年以上若干管理和技术人才，其具有的工作经验、技术积累和执行能力是本项目顺利实施的保障。此外，公司对隔膜相关技术进行了相应的储备，并拥有相应的专利技术。
25640769,惠誉意外下调美国信用评级，分析师很淡定：对美债和美元影响不大,https://news.moomoo.com/post/25640769,来源：智通财经作者：马火敏分析师们表示，尽管惠誉下调了美国的信用评级，但投资者仍将继续买入美国国债，尽管降级可能会引发一些短期波动。分析师们表示，对美国债券的需求可能会保持强劲，因为很少有市场足够大、足够安全，可以作为替代选择。他们补充称，美元的疲软预计也不会持续下去。以下是分析师和策略师的看法：不会对美债产生太大影响Pendal Group收入策略主管Amy Xie  Patrick表示，如果投资者要出售美国国债，就需要有一个安全且足够大的替代市场。她表示，由于缺乏财政统一，欧元区债券面临碎片化风险，日本央行仍然拥有日本国债市场的一半债券。Patrick表示：“要让人们开始认真对待这些降级事件，并停止购买高质量的美国国债，还需要很多时间。这些与高质量的发达市场主权评级有关的降级事件，有点像债务上限问题——可能会引起一些短期焦虑，但永远不会有太大影响。”NatWest Markets新兴市场策略师Galvin  Chia表示：“从投资的角度来看，我认为没有理由在投资组合中减持美国国债，即使这种资产面临更高的政治风险。总的来说，对俄罗斯金融市场的制裁和去美元化等问题将引发更多关于美国资产在金融市场中的作用的问题，而不是评级本身。”Jamieson Coote Bonds的高级投资组合经理James  Wilson表示：“我们不认为惠誉的降级会对市场产生巨大影响，因为此举使惠誉对美国的评级与标准普尔保持一致。标准普尔在2011年下调美国评级至AA+。自那以来，美国金融体系经受了更大的风暴，而推动收益率走高的更大因素是，随着美国宣布扩大国债发行规模，市场将出现美国国债供应过剩。过去一年，10年期美国国债收益率突破了4%，这是投资者的底线。我预计这种需求会持续下去。”高盛经济学家Alec  Phillips表示：“降级主要反映了治理和中期财政挑战，但没有反映新的财政信息。评级下调应该不会对金融市场产生直接影响，因为不太可能有美国国债的主要持有者因为评级下调而被迫抛售。”RBC资本市场亚洲外汇策略主管Alvin  Tan表示：“美国国债是全球规模最大、流动性最强的主权债券市场。难以想象大型全球债券投资者会决定将美国国债完全排除在他们的资产之外。如果他们这样做，他们将持有哪些美元计价债券?一些投资者可能不得不减少投资，尤其是非美国注册基金。但如果他们中的许多人决定修改规则以继续持有美国国债，我不会感到惊讶。”大华银行经济学家Ho Woei  Chen表示：“投资者不太可能因为评级下调而大批抛售美国国债，因为它们仍然是流动性最强、最安全的资产之一。多元化投资将继续进行，但评级下调不太可能引发本能反应。多元化发生的原因包括地缘政治紧张局势。”对美元的影响不大澳新银行利率策略师David  Croy表示：“我认为市场对此会有两种想法——从表面上看，这是对美国声誉和地位的污点，但同样地，如果它引发市场紧张和避险行为，很容易就会看到购买美国国债和美元的避险行为。市场达到良好的平衡状态。”摩根大通宏观利率和外汇销售执行董事Laura Fitzsimmons  表示：“2011年的经历表明，在这种环境下，美元和美债纷纷转变为优质资产，鉴于美国在全球的关键地位，这与主权信用评级被下调时通常会发生的情况相反。因此，对外汇投资者来说，这里的交易不那么明显，但我们将拭目以待，看看是否会有更多的负面反应引发投资者的兴趣。”澳大利亚联邦银行外汇策略师Carol  Kong表示：“如果市场认为评级下调将削弱美元的储备货币地位，并且市场抛售所持美国国债，美元可能在未来几个交易日进一步走软。但我不认为美元会持续下跌。信用评级通常不是货币的主要中期驱动因素。”野村证券的利率策略师Andrew  Ticehurst表示：“美元的表现可能不及一些主要货币，比如欧元和日元。当然，如果这一消息导致一些广泛的避险行为，那么亚洲地区贝塔系数较高的货币的表现应该不会那么好。具有讽刺意味的是，如果这条消息导致一些避险行为，资金可能会流向防御性资产，其中包括高流动性的美国国债。”Vanda Research宏观策略师Viraj  Patel表示：“如果美元因惠誉评级的消息而被抛售，就逢低买入，因为近期违约的可能性并不大。关键将是股市如何反应——这是否会打击“金发姑娘”式的反弹。这可能是跨资产市场的关键，尤其是外汇市场。”麦格理货币和利率策略师Gareth  Berry表示：“我们以前经历过这种情况，知道金融体系能够应对。不过，美国股市今天晚些时候可能会遇到一些温和的抛售压力，这给澳元兑美元在美国交易时段带来一些下行风险，尽管ADP就业数据的任何意外都可能压倒这种市场反应。”编辑/tolk
25647584,景顺：日本允许10年期债券收益率的实际上限升至1% 或继续保持宽松货币政策,https://news.moomoo.com/post/25647584,智通财经APP获悉，景顺日本环球市场策略师Tomo  Kinoshita发布报告称，当前日本经济依然强劲，日本长期债券收益率的升幅受限及日元升值不太可能会削弱经济。随着日本经济相对美国及欧洲持续转强，预计2023年下半年日本股市表现将优于其他已发展经济体。Tomo  Kinoshita指出，日本央行决定调整收益率曲线控制政策，允许10年期债券收益率的实际上限升至1%，这项决议令市场倍感意外。10年期债券收益率0.5%的名义上限保持不变。该决议旨在灵活应对上行及下行风险，提升货币放宽的可持续性。这意味着该决议并非针对放宽或收紧货币政策。日本央行维持2024及2025财政年度的核心CPI通胀(除新鲜食品及能源外)展望于1.7%及1.8%。这反映日本央行预期仍未实现2%的通胀目标，可能继续维持宽松的货币政策。日本央行行长植田和男提到，他预计10年期债券收益率并不会升至1%，因为1%只是作为上限。日本央行预计将继续透过调整买债操作及实施指定价格买债操作控制收益率曲线(及10年期债券收益率)。倘若日本长期债券收益率进一步上升，美国债券收益率会受到上行压力，日本机构投资者对美国债券的投资可能有所减少。长期来看，Tomo  Kinoshita预计2024年企业与工会之间于春季的集体谈判可能推动工资大幅增长，从而令日本央行在2024年4月份召开的政策会议上同时上调短期及长期政策利率。在此之后，日本央行可能在进一步收紧货币政策之际取消收益率曲线控制政策。Tomo  Kinoshita亦提示到，10年期债券收益率短期内对日本金融市场至关重要，日元升值及加息对企业表现的负面影响将反映在股价当中。倘若10年期债券收益率升至新的1%实际上限，日元兑美元将进一步升值。
25647537,力星股份筹码连续3期集中,https://news.moomoo.com/post/25647537,证券时报网讯，力星股份8月2日在交易所互动平台中披露，截至7月31日公司股东户数为18073户，较上期(7月20日)减少574户，环比降幅为3.08%。这已是该公司股东户数连续第3期下降，累计降幅达21.09%，也就是说筹码呈持续集中趋势。证券时报·数据宝统计，截至发稿，力星股份收盘价为10.01元，上涨0.20%，筹码持续集中以来股价累计下跌16.16%。具体到各交易日，8次上涨，15次下跌。
25647354,广州：鼓励民营企业积极参与人工智能应用场景建设,https://news.moomoo.com/post/25647354,广州市今日发布促进民营经济发展壮大的若干措施，其中提到，打造和开放创新应用场景。聚焦应用场景示范，鼓励民营企业积极参与人工智能应用场景建设。在智能制造、智慧城市、智慧交通、智慧教育、智慧医疗等多个领域加大应用场景开放力度，支持民营企业参与应用场景设计与建设，促进人工智能与其他产业链的融合和赋能。依托行业专业机构牵头组织人工智能企业产业场景应用对接，加快产品产业转化。
25647353,8月2日沪深两市涨停分析,https://news.moomoo.com/post/25647353,沪指震荡调整跌0.89%，超导、复合集流体概念走强。超导概念股法尔胜录得6天4板，财达证券、百利电气、中孚实业等2连板，一图看懂>>
